729,Venture Round - DV SANTE,https://www.crunchbase.com/funding_round/dv-sante-series-unknown--67afd9d1,Health Care,"Bordeaux, Aquitaine, France, Europe",DV SANTE,https://www.crunchbase.com/organization/dv-sante,Venture - Series Unknown,,,,2018-04-01,,DV SANTE Provider of ergonomic solutions intended to simply organize the return and the home support by mobilizing the necessary ecosystem.,,USD,,1,,,,http://dvsante.fr/,Olbia Invest,1.0,,,,Yes
730,Venture Round - Helpevia,https://www.crunchbase.com/funding_round/helpevia-series-unknown--71ba6957,"Health Care, Medical, Pharmaceutical","Rouen, Haute-Normandie, France, Europe",Helpevia,https://www.crunchbase.com/organization/helpevia,Venture - Series Unknown,,,,2021-04-20,,Helpevia is a medical supplies company involves in purchase and distribution of all kinds of medical needs.,,USD,,1,,$10M to $50M,,https://www.helpevia.fr/,UI Investissement,1.0,,,,Yes
731,Venture Round - Move in med,https://www.crunchbase.com/funding_round/move-in-med-series-unknown--27b4b7f9,"Health Care, Hospital, Software","Baillargues, Languedoc-Roussillon, France, Europe",Move in med,https://www.crunchbase.com/organization/move-in-med,Venture - Series Unknown,1350000.0,EUR,1649834.0,2018-01-19,,Development of digital tools and innovative services to coordinate the care of patients with chronic diseases,1350000.0,EUR,1649834.0,1,,Less than $1M,,https://www.moveinmed.com/,"Sofilaro, Soridec",2.0,,,,Yes
732,Venture Round - Microphyt,https://www.crunchbase.com/funding_round/microphyt-series-unknown--96be0796,"Biotechnology, Fitness, Food and Beverage, Health Care, Natural Resources, Nutrition","Baillargues, Languedoc-Roussillon, France, Europe",Microphyt,https://www.crunchbase.com/organization/microphyt,Venture - Series Unknown,28500000.0,EUR,31932665.0,2019-07-09,,"Microphyt researches, develops, produces, and markets natural algae-based products that contribute to weight loss and to brain health.",47330029.0,EUR,52223153.0,5,Early Stage Venture,,"Bpifrance, Sofinnova Partners",http://www.microphyt.eu/,"Bpifrance, Demeter Partners, IRDI SORIDEC Gestion, Sofinnova Partners, Supernova Invest",5.0,,,,Yes
733,Venture Round - DigitecPharma,https://www.crunchbase.com/funding_round/digitecpharma-series-unknown--258e6e30,"Apps, Health Care, Mobile, Pharmaceutical, SaaS","La Ciotat, Provence-Alpes-Cote d'Azur, France, Europe",DigitecPharma,https://www.crunchbase.com/organization/digitecpharma,Venture - Series Unknown,1200000.0,EUR,1445608.0,2021-02-17,,DigitecPharma is a SaaS powered mobile application platform for patient relationship management for pharmaceutical dispensaries.,1200000.0,EUR,1445609.0,1,,Less than $1M,,https://www.digitecpharma.fr/,"Extens, Région Sud Investissement",2.0,,,,Yes
734,Venture Round - Wellium,https://www.crunchbase.com/funding_round/wellium-series-unknown--f4b3876c,"Health Care, Internet","Paris, Ile-de-France, France, Europe",Wellium,https://www.crunchbase.com/organization/wellium,Venture - Series Unknown,2000000.0,EUR,2233389.0,2020-03-27,,Wellium is a medical teleconsultation solution allowing doctors to consult their patients online.,2000000.0,EUR,2233389.0,1,,$1B to $10B,,https://www.wellium.io,"AdBio partners, MACSF",2.0,,,,Yes
735,Venture Round - Horus pharma,https://www.crunchbase.com/funding_round/horus-pharma-series-unknown--9ebcd6dd,"Biotechnology, Health Care, Medical, Pharmaceutical","Saint-laurent-du-var, Provence-Alpes-Cote d'Azur, France, Europe",Horus pharma,https://www.crunchbase.com/organization/horus-pharma,Venture - Series Unknown,23000000.0,EUR,25349883.0,2022-03-16,,Horus Pharma is a pharmaceutical company that focuses around ocular pathology and peri-surgery.,23050000.0,EUR,25412980.0,2,,,Eurazeo,http://www.horus-pharma.com,Eurazeo,1.0,,,,Yes
736,Venture Round - Keenturtle,https://www.crunchbase.com/funding_round/keenturtle-series-unknown--a199f713,"Database, Health Care, Medical, Medical Device","Paris, Ile-de-France, France, Europe",Keenturtle,https://www.crunchbase.com/organization/keenturtle,Venture - Series Unknown,1500000.0,EUR,1781119.0,2021-08-02,,Keenturtle is a medical technology company that offers e health solutions.,1500000.0,EUR,1781119.0,1,,$1M to $10M,"Extens, Sham Innovation Santé",https://www.keenturtle.com/,"Extens, Sham Innovation Santé",2.0,,,,Yes
737,Venture Round - Deuxièmeavis.fr,https://www.crunchbase.com/funding_round/deuxièmeavis-fr-series-unknown--982edb6b,"Health Care, Medical","Paris, Ile-de-France, France, Europe",Deuxièmeavis.fr,https://www.crunchbase.com/organization/deuxièmeavis-fr,Venture - Series Unknown,2500000.0,EUR,2890507.0,2018-09-07,,Deuxièmeavis.fr is a Medical startup.,2590000.0,EUR,2988731.0,2,,,,https://www.deuxiemeavis.fr/,"Citizen Capital, Colam Impact, Investir&+",3.0,,,,Yes
738,Venture Round - Biolog-id,https://www.crunchbase.com/funding_round/biolog-id-series-unknown--990d1081,"Biotechnology, Health Care, Identity Management","Bernay, Pays de la Loire, France, Europe",Biolog-id,https://www.crunchbase.com/organization/biolog-id,Venture - Series Unknown,25000000.0,USD,25000000.0,2022-05-05,,"Biolog-id designs, develops and markets identification and traceability solutions for the healthcare industry.",65945392.0,USD,65945392.0,3,,,Xerys,https://www.biolog-id.com/,Xerys,1.0,,,,Yes
739,Venture Round - LiMM Therapeutics,https://www.crunchbase.com/funding_round/limm-therapeutics-series-unknown--cb030e6a,"Biotechnology, Health Care, Medical Device, Therapeutics","Paris, Ile-de-France, France, Europe",LiMM Therapeutics,https://www.crunchbase.com/organization/limm-therapeutics,Venture - Series Unknown,2500000.0,EUR,2925252.0,2018-06-25,,LiMM Therapeutics is a biopharmaceutical company that harnesses the molecular cross-talk between neuronal and innate lymphoid cells.,7000000.0,EUR,8075433.0,4,Seed,,,https://www.limmtx.com/,"200M, Seventure Partners",2.0,,,,Yes
740,Venture Round - Stiplastics S.A.S.,https://www.crunchbase.com/funding_round/stiplastics-s-a-s-series-unknown--8e01ce8c,"Health Care, Manufacturing, Medical Device","Saint-marcellin, Rhone-Alpes, France, Europe",Stiplastics S.A.S.,https://www.crunchbase.com/organization/stiplastics-s-a-s,Venture - Series Unknown,,,,2018-01-18,,"Stiplastics S.A.S. engages in designing, developing, and manufacturing medical devices.",,USD,,1,M&A,,,http://www.stiplastics.com/,"Gimv, Merieux Developpement",2.0,,,,Yes
741,Funding Round - Marguerite & Cie,https://www.crunchbase.com/funding_round/marguerite-cie-undisclosed--1dd500fd,"Health Care, Retail","Plobannalec, Bretagne, France, Europe",Marguerite & Cie,https://www.crunchbase.com/organization/marguerite-cie,Funding Round,1500000.0,EUR,1636929.0,2023-07-03,,Marguerite & Cie develops biodegradable menstrual products free to end period-related inequalities.,1500000.0,EUR,1636929.0,1,,,,https://margueriteetcie.com/,,,,,,Yes
742,Funding Round - FAB'ONE,https://www.crunchbase.com/funding_round/fab-one-undisclosed--fa91a7ef,"B2B, B2C, Consumer Electronics, Hardware, Health Care, Industrial, Military, Outdoors, Sporting Goods, Sports","Besançon, Franche-Comte, France, Europe",FAB'ONE,https://www.crunchbase.com/organization/fab-one,Funding Round,115000.0,EUR,142706.0,2018-01-30,,FAB'ONE develops KAPTREK solutions.,270000.0,EUR,314544.0,3,Seed,,,https://kaptrek.com,,,,,,Yes
743,Funding Round - SentinHealth,https://www.crunchbase.com/funding_round/sentinhealth-undisclosed--f9adf8b4,"Artificial Intelligence, Health Care, Life Science, Medical Device, Wellness","Paris, Ile-de-France, France, Europe",SentinHealth,https://www.crunchbase.com/organization/sentinhealth,Funding Round,465200.0,EUR,522912.0,2022-01-26,,SentinHealth develops AI-powered sentinels to revolutionize the management of chronic diseases and heart failure.,3866315.0,EUR,4352187.0,6,,,,https://sentinhealth.com,,,,,,Yes
744,Funding Round - Cell-Easy,https://www.crunchbase.com/funding_round/cell-easy-undisclosed--59891c7b,"Biotechnology, Health Care","Toulouse, Midi-Pyrenees, France, Europe",Cell-Easy,https://www.crunchbase.com/organization/cell-easy,Funding Round,7800000.0,EUR,8747199.0,2022-02-28,,Cell-Easy is a CDMO that specializes in preclinical and clinical drug development.,7800000.0,EUR,8747199.0,1,,,Bpifrance,http://cell-easy.com,"Bpifrance, RÉGION OCCITANIE",2.0,,,,Yes
745,Funding Round - Activ'Inside,https://www.crunchbase.com/funding_round/activ-inside-undisclosed--6a6949dc,"Health Care, Manufacturing, Product Research, Wellness","Bordeaux, Aquitaine, France, Europe",Activ'Inside,https://www.crunchbase.com/organization/activ-inside,Funding Round,4000000.0,EUR,4861815.0,2020-12-15,,Activ'Inside manufactures botanical ingredients and formulations to commercialize the products for well-being markets.,4000000.0,EUR,4861815.0,1,,,,https://activinside.com/,"AQUITI Gestion, Bpifrance",2.0,,,,Yes
746,Funding Round - Bioc3,https://www.crunchbase.com/funding_round/bioc3-undisclosed--95d354dc,"AgTech, Biotechnology, Health Care, Life Science","Ramonville-saint-agne, Midi-Pyrenees, France, Europe",Bioc3,https://www.crunchbase.com/organization/bioc3,Funding Round,,,,2019-04-16,,Bioc3 is a producer of a microbial synthesis technique intended to synthesise dihydroxyacetone phosphate.,,USD,,1,,,,https://www.bioc3.com/,,,,,,Yes
0,Angel Round - Medway Assistance,https://www.crunchbase.com/funding_round/medway-assistance-angel--2ea30fe0,"Computer, Health Care","Paris, Ile-de-France, France, Europe",Medway Assistance,https://www.crunchbase.com/organization/medway-assistance,Angel,60000.0,EUR,65198.0,2017-04-24,Seed,"Medway Assistance provides permanent access to a medical practioner 24/7, 365 days per year.",60000.0,EUR,65199.0,1,Seed,,,http://www.medway-assistance.com,,,300000.0,EUR,325994.0,Yes
1,Angel Round - sojami,https://www.crunchbase.com/funding_round/sojami-angel--d77b4410,"Consumer Goods, Food and Beverage, Health Care","Paris, Ile-de-France, France, Europe",sojami,https://www.crunchbase.com/organization/sojami,Angel,110000.0,EUR,143254.0,2012-10-19,Seed,sojami is a producer of vegan cheese and dessert preparations based on lactofermented soybeans designed to reconcile health.,110000.0,EUR,143254.0,1,Seed,,Capitole Angels,http://www.lesojami.com,Capitole Angels,1.0,,,,Yes
2,Angel Round - BackBone,https://www.crunchbase.com/funding_round/backbone-df41-angel--ef74d8fd,"Health Care, Medical","Le Bouscat, Aquitaine, France, Europe",BackBone,https://www.crunchbase.com/organization/backbone-df41,Angel,1000000.0,EUR,1179099.0,2017-11-17,Seed,"BackBone specializes in the creation, production and marketing of movement preservation solutions for the treatment of spinal pathologies.",1000000.0,EUR,1179099.0,1,M&A,$1M to $10M,Bpifrance,https://www.mamieandco.com,"Bpifrance, Dynalim, Finaqui, IRDI, Limousin Business Angels, Synergence",6.0,,,,Yes
3,Angel Round - Regulaxis SAS,https://www.crunchbase.com/funding_round/regulaxis-sas-angel--6a5678f9,"Biotechnology, Health Care, Therapeutics","Romainville, Ile-de-France, France, Europe",Regulaxis SAS,https://www.crunchbase.com/organization/regulaxis-sas,Angel,398300.0,EUR,419170.0,2016-12-30,Seed,"Regulaxis is focused in research, development and licensing of human innovative synthetic molecules for high unmet medical needs",3212270.0,EUR,3590534.0,5,Seed,$1M to $10M,,http://regulaxis.com/,,,,,,Yes
4,Angel Round - 1001Pharmacies,https://www.crunchbase.com/funding_round/1001pharmacies-com-angel--d083d475,"Cosmetics, E-Commerce, Health Care, Personal Health, Pharmaceutical, Retail","Montpellier, Languedoc-Roussillon, France, Europe",1001Pharmacies,https://www.crunchbase.com/organization/1001pharmacies-com,Angel,600000.0,EUR,792443.0,2013-01-01,Seed,1001Pharmacies is a French drugstore that sells personal health and well-being products online.,9692443.0,USD,9692443.0,2,M&A,$1M to $10M,,http://www.1001pharmacies.com/,Marc Menase,1.0,,,,Yes
5,Angel Round - Zyken - NightCove,https://www.crunchbase.com/funding_round/zyken-nightcove-angel--c0fb6847,"Hardware, Health Care","Paris, Ile-de-France, France, Europe",Zyken - NightCove,https://www.crunchbase.com/organization/zyken-nightcove,Angel,1350000.0,EUR,1775509.0,2007-01-01,Seed,"Zyken develops innovative premium wellness products for hotel guestrooms, spas, and homes.",3369505.0,USD,3369505.0,4,M&A,$1M to $10M,,http://www.zyken.com,,,,,,Yes
6,Angel Round - Tinteo,https://www.crunchbase.com/funding_round/tinteo-angel--4589e505,"Hardware, Health Care, Music, Personal Health, Software","Meyreuil, Provence-Alpes-Cote d'Azur, France, Europe",Tinteo,https://www.crunchbase.com/organization/tinteo,Angel,100000.0,EUR,125461.0,2012-06-06,Seed,Tinteo designs and commercialize PSAPs (personal sound amplifiers) and communication systems for people with hearing defects.,395461.0,USD,395461.0,3,Seed,,,http://www.tinteo.com,,,,,,Yes
7,Angel Round - Regulaxis SAS,https://www.crunchbase.com/funding_round/regulaxis-sas-angel--7e4bce4d,"Biotechnology, Health Care, Therapeutics","Romainville, Ile-de-France, France, Europe",Regulaxis SAS,https://www.crunchbase.com/organization/regulaxis-sas,Angel,344000.0,EUR,383820.0,2015-07-10,Seed,"Regulaxis is focused in research, development and licensing of human innovative synthetic molecules for high unmet medical needs",3212270.0,EUR,3590534.0,5,Seed,$1M to $10M,,http://regulaxis.com/,,,,,,Yes
8,Angel Round - xRapid,https://www.crunchbase.com/funding_round/xrapid-angel--9a0caf6d,"Biotechnology, Health Care, Health Diagnostics, Medical, Mobile","Aix-en-provence, Provence-Alpes-Cote d'Azur, France, Europe",xRapid,https://www.crunchbase.com/organization/xrapid,Angel,250000.0,USD,250000.0,2016-06-15,Seed,xRapid is a mobile health diagnosis through disruptive solutions leveraging the use of artificial intelligence.,600000.0,USD,600000.0,3,Early Stage Venture,$1M to $10M,,https://xrapid-group.com/,Charles-Edouard Bouee,1.0,,,,Yes
9,Angel Round - Zyken - NightCove,https://www.crunchbase.com/funding_round/zyken-nightcove-angel--29ef167c,"Hardware, Health Care","Paris, Ile-de-France, France, Europe",Zyken - NightCove,https://www.crunchbase.com/organization/zyken-nightcove,Angel,500000.0,EUR,665197.0,2010-05-01,Seed,"Zyken develops innovative premium wellness products for hotel guestrooms, spas, and homes.",3369505.0,USD,3369505.0,4,M&A,$1M to $10M,,http://www.zyken.com,,,,,,Yes
10,Angel Round - Tinteo,https://www.crunchbase.com/funding_round/tinteo-angel--768cf0c7,"Hardware, Health Care, Music, Personal Health, Software","Meyreuil, Provence-Alpes-Cote d'Azur, France, Europe",Tinteo,https://www.crunchbase.com/organization/tinteo,Angel,130000.0,USD,130000.0,2014-11-30,Seed,Tinteo designs and commercialize PSAPs (personal sound amplifiers) and communication systems for people with hearing defects.,395461.0,USD,395461.0,3,Seed,,,http://www.tinteo.com,,,,,,Yes
11,Angel Round - Eligo Bioscience,https://www.crunchbase.com/funding_round/eligo-bioscience-angel--ca7cc6b4,"Biotechnology, Health Care, Medical","Paris, Ile-de-France, France, Europe",Eligo Bioscience,https://www.crunchbase.com/organization/eligo-bioscience,Angel,,,,2015-01-01,Seed,"Eligobiotics provides a new approach to explore, understand, and control bacterial ecosystems both in human and animals.",39806084.0,USD,39806084.0,8,,$1M to $10M,,https://eligo.bio/,AGORANOV,1.0,,,,Yes
12,Angel Round - Mahler,https://www.crunchbase.com/funding_round/mahler-angel--1bac5c61,"Beauty, Cosmetics, Health Care, Personal Health","Bordeaux, Aquitaine, France, Europe",Mahler,https://www.crunchbase.com/organization/mahler,Angel,,,,2017-11-29,Seed,MAHLER is a dermocosmetic company that develops specialized treatments for the face and body.,,USD,,1,Seed,$10M to $50M,Limousin Business Angels,http://www.simonemahler.com/fr/,Limousin Business Angels,1.0,,,,Yes
13,Angel Round - Kamax,https://www.crunchbase.com/funding_round/kamax-angel--ae1fb978,"Biotechnology, Health Care, Health Diagnostics","Limoges, Limousin, France, Europe",Kamax,https://www.crunchbase.com/organization/kamax,Angel,,,,2017-11-29,Seed,"KAMAX designs and develops a new real-time imaging system, based on the polarization of light, for the diagnosis of cancerous pathologies.",440000.0,EUR,514805.0,2,,$50M to $100M,Limousin Business Angels,http://kamax-innovative.com,Limousin Business Angels,1.0,,,,Yes
14,Angel Round - OSMOS Group,https://www.crunchbase.com/funding_round/osmos-dce5-angel--397cb917,"Civil Engineering, Health Care","Paris, Ile-de-France, France, Europe",OSMOS Group,https://www.crunchbase.com/organization/osmos-dce5,Angel,,,,2001-01-01,Seed,OSMOS Group is a technology company that offers to monitor the health of structures continuously.,2720000.0,USD,2720000.0,2,,,,https://www.osmos-group.com/,,,,,,Yes
15,Angel Round - DocForYou,https://www.crunchbase.com/funding_round/docforyou-angel--360d9891,"Apps, Health Care, Medical","Bastia, Corse, France, Europe",DocForYou,https://www.crunchbase.com/organization/docforyou,Angel,200000.0,EUR,269453.0,2013-11-05,Seed,DocForYou is a smartphone application that enables users to check their symptoms for diseases.,200000.0,EUR,269454.0,1,Seed,Less than $1M,,http://www.docforyou.com,Olivier David,1.0,,,,Yes
16,Angel Round - Zyken - NightCove,https://www.crunchbase.com/funding_round/zyken-nightcove-angel--3e65ec75,"Hardware, Health Care","Paris, Ile-de-France, France, Europe",Zyken - NightCove,https://www.crunchbase.com/organization/zyken-nightcove,Angel,600000.0,USD,600000.0,2012-04-01,Seed,"Zyken develops innovative premium wellness products for hotel guestrooms, spas, and homes.",3369505.0,USD,3369505.0,4,M&A,$1M to $10M,,http://www.zyken.com,Extend Capital,1.0,,,,Yes
17,Angel Round - Mélipharm,https://www.crunchbase.com/funding_round/mélipharm-angel--f25a4f87,"Health Care, Medical, Medical Device","Limoges, Limousin, France, Europe",Mélipharm,https://www.crunchbase.com/organization/mélipharm,Angel,,,,2017-11-29,Seed,Mélipharm develops sterile medical devices for the treatment of acute and chronic wounds based on selected monofloral honey.,,USD,,1,Seed,,Limousin Business Angels,http://www.melipharm.com/,Limousin Business Angels,1.0,,,,Yes
18,Angel Round - REGEnLIFE,https://www.crunchbase.com/funding_round/regenlife-angel--91748037,"Health Care, Life Science, Medical Device, Neuroscience","Paris, Ile-de-France, France, Europe",REGEnLIFE,https://www.crunchbase.com/organization/regenlife,Angel,100000.0,EUR,113855.0,2016-06-23,Seed,MedTech company focused on neurodegenerative diseases,8300000.0,EUR,9381272.0,5,,,,https://regenlife.com,,,,,,Yes
19,Angel Round - Teqoya,https://www.crunchbase.com/funding_round/teqoya-angel--aac708f0,Health Care,"Paris, Ile-de-France, France, Europe",Teqoya,https://www.crunchbase.com/organization/teqoya,Angel,1000000.0,EUR,1162854.0,2017-11-01,Seed,Teqoya is a designer and manufacturer of air purifiers.,1120000.0,EUR,1297473.0,2,Seed,Less than $1M,,http://www.teqoya.com/,,,,,,Yes
20,Angel Round - ZenSoon,https://www.crunchbase.com/funding_round/zensoon-angel--7a06f84b,"Beauty, E-Commerce, Health Care, Internet","Paris, Ile-de-France, France, Europe",ZenSoon,https://www.crunchbase.com/organization/zensoon,Angel,325000.0,EUR,429325.0,2013-09-01,Seed,The first beauty and wellness booking system in France,325000.0,EUR,429326.0,1,M&A,,,http://www.zensoon.com,"Denis Fayolle, MIND MEDIA",2.0,,,,Yes
21,Angel Round - Tabbya,https://www.crunchbase.com/funding_round/tabbya-angel--b82bedc1,"Health Care, Home Health Care, Security","Viroflay, Ile-de-France, France, Europe",Tabbya,https://www.crunchbase.com/organization/tabbya,Angel,58000.0,EUR,61030.0,2016-12-31,Seed,"We are tech’s simplifiers. We adapt mass-market products to enable new use cases for eHealth, safety & distant care.",141070.0,EUR,167341.0,2,Seed,,,http://www.tabbya.com,,,591000.0,EUR,621882.0,Yes
22,Convertible Note - Leka,https://www.crunchbase.com/funding_round/leka-convertible-note--9df458da,"Education, Health Care, Robotics, Software, Toys","Paris, Ile-de-France, France, Europe",Leka,https://www.crunchbase.com/organization/leka,Convertible Note,100000.0,USD,100000.0,2016-03-07,,Leka is a exceptional children lives exceptional lives.,220000.0,USD,220000.0,3,Seed,$1M to $10M,,http://leka.io,Right Side Capital Management,1.0,,,,No
23,Convertible Note - AmpliSense,https://www.crunchbase.com/funding_round/amplisense-convertible-note--012f9567,"Child Care, Cloud Data Services, Hardware, Health Care, mHealth, Software","Voisins-le-bretonneux, Ile-de-France, France, Europe",AmpliSense,https://www.crunchbase.com/organization/amplisense,Convertible Note,47050.0,EUR,62140.0,2013-01-01,,A medical device product for children's health care monitoring,205089.0,USD,205089.0,3,Seed,Less than $1M,,http://www.amplisense.com/,Wayra,1.0,,,,No
24,Convertible Note - Kolibree,https://www.crunchbase.com/funding_round/kolibree-convertible-note--007e96f1,"Dental, Fitness, Health Care, Wellness","Neuilly-sur-seine, Ile-de-France, France, Europe",Kolibree,https://www.crunchbase.com/organization/kolibree,Convertible Note,,,,2015-08-12,,Kolibree is a smart electric toothbrush that connects to your mobile device.,5698314.0,USD,5698314.0,3,Early Stage Venture,,SOSV,http://kolibree.com,SOSV,1.0,,,,No
25,Convertible Note - Moona,https://www.crunchbase.com/funding_round/moona-convertible-note--e24ce1ca,"Hardware, Health Care, Home Health Care, Internet of Things, Wellness","Paris, Ile-de-France, France, Europe",Moona,https://www.crunchbase.com/organization/moona,Convertible Note,,,,2017-10-24,,Moona is a revolutionary sleep device that actively improves sleep through temperature.,994540.0,USD,994540.0,6,Seed,Less than $1M,SOSV,https://en.getmoona.com,"HAX, SOSV",2.0,,,,No
26,Convertible Note - Alantaya,https://www.crunchbase.com/funding_round/alantaya-convertible-note--f90e0a30,"Food and Beverage, Health Care, Nutrition, Personal Health, Therapeutics","Paris, Ile-de-France, France, Europe",Alantaya,https://www.crunchbase.com/organization/alantaya,Convertible Note,2500000.0,EUR,2794626.0,2016-03-24,,"ALANTAYA organizes data from ingredients, pathologies, cooking recipes in order to deliver a high personnalized nutritionnal recommandation.",2780000.0,EUR,3179787.0,2,,$1M to $10M,,http://www.alantaya.com/,,,,,,No
27,Convertible Note - Japet Medical,https://www.crunchbase.com/funding_round/japet-medical-devices-convertible-note--f3bdc624,"Biotechnology, Health Care, Medical Device, Robotics","Loos, Nord-Pas-de-Calais, France, Europe",Japet Medical,https://www.crunchbase.com/organization/japet-medical-devices,Convertible Note,,,,2016-11-09,,Japet Medical Devices is a French biomedical company developing robotic equipment for the most advanced quality of treatment.,1700000.0,USD,1700000.0,8,Seed,Less than $1M,,http://japet.eu,"HAX, SOSV",2.0,,,,No
28,Corporate Round - Nouveal e-santé,https://www.crunchbase.com/funding_round/nouveal-e-santé-corporate-round--6efb573c,"Health Care, Internet, Mobile","Irigny, Rhone-Alpes, France, Europe",Nouveal e-santé,https://www.crunchbase.com/organization/nouveal-e-santé,Corporate Round,750000.0,EUR,879895.0,2017-10-02,,Nouveal e-santé is develops digital mobile solutions dedicated to the medical sector.,1750000.0,EUR,1923192.0,3,,,Elior Group,https://nouveal.com/,Elior Group,1.0,,,,Yes
29,Corporate Round - Nouveal e-santé,https://www.crunchbase.com/funding_round/nouveal-e-santé-corporate-round--f64070a8,"Health Care, Internet, Mobile","Irigny, Rhone-Alpes, France, Europe",Nouveal e-santé,https://www.crunchbase.com/organization/nouveal-e-santé,Corporate Round,1000000.0,EUR,1043296.0,2016-12-16,,Nouveal e-santé is develops digital mobile solutions dedicated to the medical sector.,1750000.0,EUR,1923192.0,3,,,Malakoff Mederic,https://nouveal.com/,Malakoff Mederic,1.0,,,,Yes
30,Debt Financing - Nature et Vitalite,https://www.crunchbase.com/funding_round/nature-et-vitalite-debt-financing--ca957e17,"Consumer Electronics, E-Commerce, Health Care","Lyon, Rhone-Alpes, France, Europe",Nature et Vitalite,https://www.crunchbase.com/organization/nature-et-vitalite,Debt Financing,4300000.0,EUR,4790056.0,2016-05-30,,Nature et Vitalite is a range of kitchen products for a healthy diet.,4300000.0,EUR,4790056.0,1,,,,https://www.nature-vitalite.com/,IXO Private Equity,1.0,,,,No
31,Debt Financing - Intech,https://www.crunchbase.com/funding_round/in-tech-medical-debt-financing--5c6a7934,"Health Care, Manufacturing, Medical, Medical Device","Rang-du-fliers, Nord-Pas-de-Calais, France, Europe",Intech,https://www.crunchbase.com/organization/in-tech-medical,Debt Financing,,,,2017-07-01,,Intech is a leading developer and manufacturer of surgical instruments and implants for the orthopedic industry.,21100000.0,USD,21100000.0,4,M&A,$100M to $500M,,http://www.intech-medical.com,Capzanine,1.0,,,,No
32,Debt Financing - The Omega Group,https://www.crunchbase.com/funding_round/the-omega-group-5e92-debt-financing--ae1bd08f,"Elder Care, Elderly, Health Care, Real Estate","Soyaux, Poitou-Charentes, France, Europe",The Omega Group,https://www.crunchbase.com/organization/the-omega-group-5e92,Debt Financing,,,,2016-10-21,,"The Omega Group is a Family, Children And Education Blog.",,USD,,1,,$100M to $500M,,https://www.groupe-omega.com/,"Blackstone Credit, Siparex Groupe",2.0,,,,No
33,Debt Financing - Marle International,https://www.crunchbase.com/funding_round/marle-international-debt-financing--79291f63,"Health Care, Manufacturing, Medical","Nogent, Champagne-Ardenne, France, Europe",Marle International,https://www.crunchbase.com/organization/marle-international,Debt Financing,,,,2014-09-01,,Marle International is a France-based implant contract manufacturing company.,,USD,,2,M&A,,Access Capital Partners,http://www.marle.fr/,Access Capital Partners,1.0,,,,No
