405,Seed Round - Smart Immune,https://www.crunchbase.com/funding_round/smart-immune-seed--d814eeb5,"Biotechnology, Health Care, Life Science, Therapeutics","Paris, Ile-de-France, France, Europe",Smart Immune,https://www.crunchbase.com/organization/smart-immune,Seed,2800000.0,EUR,3173099.0,2019-03-13,Seed,Smart Immune is a biotech company that helps fight against cancer and infection by providing a thymus-empowered T-cell therapy platform.,27255882.0,USD,27255882.0,5,,,Sebastian Lombardo,https://www.smart-immune.com,Sebastian Lombardo,1.0,13200000.0,USD,13200000.0,Yes
406,Seed Round - Qynapse,https://www.crunchbase.com/funding_round/qynapse-seed--b3c7580d,"Artificial Intelligence, Clinical Trials, Health Care, Information Technology, Machine Learning, Medical, Neuroscience, Software","Paris, Ile-de-France, France, Europe",Qynapse,https://www.crunchbase.com/organization/qynapse,Seed,1800000.0,USD,1800000.0,2020-10-10,Seed,Qynapse leverages neuroimaging & AI to advance the accuracy and reliability of Central Nervous System diseases screening and monitoring.,6600000.0,USD,6600000.0,4,Seed,$1M to $10M,,http://www.qynapse.com/,,,,,,Yes
407,Seed Round - Japet Medical,https://www.crunchbase.com/funding_round/japet-medical-devices-seed--6974791a,"Biotechnology, Health Care, Medical Device, Robotics","Loos, Nord-Pas-de-Calais, France, Europe",Japet Medical,https://www.crunchbase.com/organization/japet-medical-devices,Seed,,,,2021-07-03,Seed,Japet Medical Devices is a French biomedical company developing robotic equipment for the most advanced quality of treatment.,1700000.0,USD,1700000.0,8,Seed,Less than $1M,,http://japet.eu,"Rajat Khare, SOSV",2.0,,,,Yes
408,Seed Round - Cuure,https://www.crunchbase.com/funding_round/cuure-4978-seed--7d72e12e,"Consumer Goods, E-Commerce, Health Care, Retail Technology, Wellness","Paris, Ile-de-France, France, Europe",Cuure,https://www.crunchbase.com/organization/cuure-4978,Seed,1800000.0,EUR,2146078.0,2020-09-01,Seed,"Building the new health path. Personalized holistic health, powered by science and technology.",11800000.0,EUR,12295684.0,2,Early Stage Venture,Less than $1M,"Kima Ventures, Newfund",https://cuure.com,"Kima Ventures, Mehdi Bedadi, Newfund",3.0,,,,Yes
409,Seed Round - FLOD AI,https://www.crunchbase.com/funding_round/flod-seed--8ad5fa2a,"Artificial Intelligence, Electronics, Hardware, Health Care, Internet of Things","Reims, Champagne-Ardenne, France, Europe",FLOD AI,https://www.crunchbase.com/organization/flod,Seed,120000.0,USD,120000.0,2019-09-09,Seed,FLOD develops a Structural Health Monitoring system based on a proprietary AI technology.,341000.0,USD,341000.0,2,Seed,Less than $1M,Techstars,https://flod.ai/,Techstars,1.0,,,,Yes
410,Seed Round - SeqOne Genomics,https://www.crunchbase.com/funding_round/seqone-seed--dc6181e1,"Analytics, Big Data, Biotechnology, Health Care","Montpellier, Languedoc-Roussillon, France, Europe",SeqOne Genomics,https://www.crunchbase.com/organization/seqone,Seed,3000000.0,EUR,3368924.0,2019-03-28,Seed,SeqOne is a next generation genomic analysis for next generation healthcare.,23000000.0,EUR,26015929.0,2,Early Stage Venture,Less than $1M,Elaia,https://seqone.com,"Bpifrance, Elaia, IRDI SORIDEC Gestion",3.0,,,,Yes
411,Seed Round - Posos,https://www.crunchbase.com/funding_round/posos-seed--bfa3d70b,"Artificial Intelligence, Health Care, Machine Learning, Personal Health","Paris, Ile-de-France, France, Europe",Posos,https://www.crunchbase.com/organization/posos,Seed,2000000.0,EUR,2206699.0,2019-10-15,Seed,Posos is a clinical support platform optimizing healthcare professionals’ decisions at every step of the patient journey,2000000.0,EUR,2206699.0,1,Seed,$1M to $10M,Anaxago,https://www.posos.co/,Anaxago,1.0,,,,Yes
412,Seed Round - Cureety,https://www.crunchbase.com/funding_round/cureety-seed--e40f5bc8,"Health Care, Medical","Dinan, Bretagne, France, Europe",Cureety,https://www.crunchbase.com/organization/cureety,Seed,1200000.0,EUR,1314197.0,2020-04-01,Seed,Cureety is a telemedicine startup that improves the follow-up and care of patients.,6200000.0,EUR,6975948.0,2,Early Stage Venture,,,https://www.cureety.com/,"Bpifrance, Crédit Agricole (CA) Bretagne, Crédit Mutuel Bretagne",3.0,,,,Yes
413,Seed Round - Lucine,https://www.crunchbase.com/funding_round/lucine-seed--3dc9ce3c,"Big Data, Biotechnology, Health Care, Information Technology, Pharmaceutical","Bordeaux, Aquitaine, France, Europe",Lucine,https://www.crunchbase.com/organization/lucine,Seed,5500000.0,EUR,6514974.0,2020-11-18,Seed,Lucine has the ambition to transform and improve patient’s health.,5571429.0,EUR,6596842.0,3,Seed,Less than $1M,,https://lucine.fr,"AQUITI Gestion, BNP Paribas Développement, Bpifrance, IRDI SORIDEC Gestion, Kurma Partners",5.0,,,,Yes
414,Seed Round - HypnoVR,https://www.crunchbase.com/funding_round/hypno-vr-seed--29e73d4f,"Health Care, Medical, Medical Device, Software, Virtual Reality","Strasbourg, Alsace, France, Europe",HypnoVR,https://www.crunchbase.com/organization/hypno-vr,Seed,1000000.0,EUR,1125715.0,2020-06-12,Seed,"HypnoVR is a virtual reality software for anesthesia, treatment of pain and anxiety.",6000000.0,EUR,6788742.0,3,Early Stage Venture,Less than $1M,,http://hypnovr.io,,,,,,Yes
415,Seed Round - Defymed,https://www.crunchbase.com/funding_round/defymed-seed--88f54f5f,"Diabetes, Health Care, Medical Device","Strasbourg, Alsace, France, Europe",Defymed,https://www.crunchbase.com/organization/defymed,Seed,1000000.0,EUR,1083887.0,2020-05-05,Seed,Defymed is a leader in the development of innovative implantable medical devices that change the paradigm of therapeutics' administration.,4700000.0,EUR,5472644.0,4,Seed,Less than $1M,Cap Innov'Est,http://defymed.com/,Cap Innov'Est,1.0,,,,Yes
416,Seed Round - Meditect,https://www.crunchbase.com/funding_round/meditect-seed--b9f7ad87,"Health Care, Medical, Pharmaceutical","Bordeaux, Aquitaine, France, Europe",Meditect,https://www.crunchbase.com/organization/meditect,Seed,1500000.0,EUR,1795486.0,2021-04-15,Seed,"Making quality medicines, available and affordable in Africa",1800000.0,EUR,2133456.0,2,Seed,,LBO France,https://www.meditect.com/,LBO France,1.0,,,,Yes
417,Seed Round - Omini,https://www.crunchbase.com/funding_round/omini-seed--759fd3cc,"Health Care, Medical","Saint-mandé, Ile-de-France, France, Europe",Omini,https://www.crunchbase.com/organization/omini,Seed,1700000.0,EUR,2055001.0,2021-02-16,Seed,Omini is a health care company that brings lab testing closer to the patient.,1700000.0,EUR,2055002.0,1,Seed,,,https://www.ominilabs.com/,"Angels Santé, Bpifrance, Entrepreneur First, INSEAD Business Angels Alumni France, Investessor",5.0,,,,Yes
418,Seed Round - Prima Vital,https://www.crunchbase.com/funding_round/prima-vital-seed--56995641,"Health Care, Life Science, Medical","Saint-raphaël, Provence-Alpes-Cote d'Azur, France, Europe",Prima Vital,https://www.crunchbase.com/organization/prima-vital,Seed,,,,2021-06-01,Seed,Prima Vital provides homecare and accessibility solutions for the elderly and people with reduced mobility.,,USD,,1,Seed,,,https://www.primavital.fr/,Omnes Capital,1.0,,,,Yes
419,Seed Round - Elmut,https://www.crunchbase.com/funding_round/elmut-seed--23d1b1bb,"Agriculture, Delivery, E-Commerce, Food and Beverage, Health Care","Paris, Ile-de-France, France, Europe",Elmut,https://www.crunchbase.com/organization/elmut,Seed,1700000.0,EUR,1918140.0,2022-01-04,Seed,Elmut is a fresh dogfood subscription that cooks and delivers fresh home-cooked meals for their dog.,3604125.0,USD,3604125.0,3,Seed,,,https://www.elmut.fr,,,,,,Yes
420,Seed Round - HEPTA Medical,https://www.crunchbase.com/funding_round/hepta-medical-seed--43ec0967,"Health Care, Medical, Medical Device","Paris, Ile-de-France, France, Europe",HEPTA Medical,https://www.crunchbase.com/organization/hepta-medical,Seed,,,,2019-06-17,Seed,"HEPTA Medical develops a sensor, embedded into a bronchoscopic or percutaneous ablation catheter, which provides temperature-based feedback.",,USD,,1,Seed,,,https://www.mdstart.eu/pages/portfolio_d/9/hepta-medical,MedTech Innovator,1.0,,,,Yes
421,Seed Round - Wefight,https://www.crunchbase.com/funding_round/wefight-seed--eabd80a5,Health Care,"Paris, Ile-de-France, France, Europe",Wefight,https://www.crunchbase.com/organization/wefight,Seed,1800000.0,EUR,1990670.0,2019-08-29,Seed,Wefight  is a conversational interface Vik automates outpatient follow-up of cancer patients.,11800000.0,EUR,13795164.0,2,Early Stage Venture,,"Angels Santé, Business Angels des Grandes Ecoles",https://www.wefight.co/,"Angels Santé, Business Angels des Grandes Ecoles, Investir&+, MELIES Business Angels",4.0,,,,Yes
422,Seed Round - Residalya,https://www.crunchbase.com/funding_round/residalya-seed--55e651ae,"Health Care, Health Insurance, Insurance","Paris, Ile-de-France, France, Europe",Residalya,https://www.crunchbase.com/organization/residalya,Seed,,,,2020-05-01,Seed,Residalya is a network of retirement and care homes for the elderly.,,USD,,1,Seed,,Eurazeo,https://www.residalya.fr/,Eurazeo,1.0,,,,Yes
423,Seed Round - Urgence Docteurs,https://www.crunchbase.com/funding_round/urgence-docteurs-seed--4089562f,"Health Care, Wellness","Paris, Ile-de-France, France, Europe",Urgence Docteurs,https://www.crunchbase.com/organization/urgence-docteurs,Seed,1200000.0,EUR,1330082.0,2019-09-15,Seed,Urgence Docteurs is the mobile app that allows you to bring a doctor at home in one hour!,1550000.0,EUR,1738460.0,3,Seed,Less than $1M,,https://urgencedocteurs.com/fr/,"Christophe Cervasel, David Amsellem, FJ Labs, Kima Ventures, Philippe ODDO, Tony Jamous",6.0,,,,Yes
424,Seed Round - Ma Blouse Blanche,https://www.crunchbase.com/funding_round/ma-blouse-blanche-seed--6aa5ecd1,Health Care,"Marseille, Provence-Alpes-Cote d'Azur, France, Europe",Ma Blouse Blanche,https://www.crunchbase.com/organization/ma-blouse-blanche,Seed,,,,2020-04-22,Seed,"online appointment websites comparator (questions all partner sites, offers doctors available quickly, location on an interactive map, ...)",,USD,,1,Seed,,,https://www.mablouseblanche.fr,OBRATORI,1.0,,,,Yes
425,Seed Round - AblaCare,https://www.crunchbase.com/funding_round/ablacare-seed--189fe549,"Health Care, Medical Device","Paris, Ile-de-France, France, Europe",AblaCare,https://www.crunchbase.com/organization/ablacare,Seed,,,,2018-09-17,Seed,AblaCare develops an innovative solution for Polycystic Ovary Syndrome (PCOS) related infertility.,10000000.0,EUR,11204444.0,2,Early Stage Venture,$1M to $10M,,https://www.ablacare.com/,MedTech Innovator,1.0,,,,Yes
426,Seed Round - Implicity,https://www.crunchbase.com/funding_round/implicity-seed--225d0488,"Artificial Intelligence, Health Care, Information Technology, Medical, Medical Device, Software","Paris, Ile-de-France, France, Europe",Implicity,https://www.crunchbase.com/organization/implicity,Seed,4000000.0,EUR,4522661.0,2019-03-14,Seed,Implicity provides to healthcare professionals a universal remote cardiac monitoring platform and AI FDA cleared algorithms.,27522661.0,USD,27522661.0,3,Early Stage Venture,,Serena,https://www.implicity.com,"Karista, Serena, XAnge",3.0,,,,Yes
427,Seed Round - Avicenna.ai,https://www.crunchbase.com/funding_round/avicenna-ai-seed--17c0e067,"Artificial Intelligence, Health Care, Medical","La Ciotat, Provence-Alpes-Cote d'Azur, France, Europe",Avicenna.ai,https://www.crunchbase.com/organization/avicenna-ai,Seed,2700000.0,EUR,2955283.0,2020-02-07,Seed,Avicenna.ai is an innovative medical device company.,9700000.0,EUR,10456154.0,3,Early Stage Venture,,"Cemag Invest, Innovacom",https://avicenna.ai/,"Cemag Invest, Innovacom",2.0,,,,Yes
428,Seed Round - Lattice Medical,https://www.crunchbase.com/funding_round/lattice-medical-seed--098f9e33,"3D Printing, Biotechnology, Health Care, Manufacturing, Medical, Medical Device","Loos, Nord-Pas-de-Calais, France, Europe",Lattice Medical,https://www.crunchbase.com/organization/lattice-medical,Seed,2300000.0,EUR,2623609.0,2018-11-05,Seed,Lattice Medical offers a 3D printed bioabsorbable medical device for breast reconstruction.,12738488.0,EUR,13414665.0,3,Early Stage Venture,$1M to $10M,"Finovam Gestion, WiSEED",http://www.lattice-medical.com,"Bpifrance, Finovam Gestion, Nord France Amorcage, WiSEED",4.0,,,,Yes
429,Seed Round - TokTokDoc,https://www.crunchbase.com/funding_round/toktokdoc-seed--d1cec794,"Fitness, Health Care, Wellness","Strasbourg, Alsace, France, Europe",TokTokDoc,https://www.crunchbase.com/organization/toktokdoc,Seed,2000000.0,EUR,2240487.0,2019-05-01,Seed,"TokTokDoc offers a telemedicine service adapted to medico-social, health  and ambulatory services in the city.",7000000.0,EUR,8276525.0,2,Early Stage Venture,,,https://toktokdoc.com/,"Crédit Mutuel Arkéa, Vivalto Santé",2.0,,,,Yes
430,Seed Round - Synapse Medicine,https://www.crunchbase.com/funding_round/synapse-medicine-seed--2de74dc4,"Health Care, Medical, Medical Device, Pharmaceutical, Software","Bordeaux, Aquitaine, France, Europe",Synapse Medicine,https://www.crunchbase.com/organization/synapse-medicine,Seed,2500000.0,EUR,2838609.0,2019-03-19,Seed,Synapse Medicine provides medication decision solutions to deliver enhanced patient-centered insights for care teams.,38669110.0,USD,38669110.0,3,Early Stage Venture,,XAnge,https://synapse-medicine.com/,XAnge,1.0,,,,Yes
431,Seed Round - Ribonexus,https://www.crunchbase.com/funding_round/agalaia-therapeutics-seed--6454c29f,"Biotechnology, Health Care, Medical, Pharmaceutical","Paris, Ile-de-France, France, Europe",Ribonexus,https://www.crunchbase.com/organization/agalaia-therapeutics,Seed,4000000.0,EUR,4678411.0,2021-09-27,Seed,Ribonexus is a biotech specializing in the development of new therapies to combat cancer disease.,6000000.0,EUR,6843636.0,3,Seed,,AdBio partners,,"AdBio partners, Crédit Mutuel Innovation, Pierre Fabre",3.0,,,,Yes
432,Seed Round - Invivox,https://www.crunchbase.com/funding_round/invivox-seed--5f6097ca,"Health Care, Medical, Professional Services","Rennes, Bretagne, France, Europe",Invivox,https://www.crunchbase.com/organization/invivox,Seed,2800000.0,EUR,3298801.0,2018-06-06,Seed,Invivox is the first worlwide plateform connecting doctors for a practical in situ medical training in 1 to 1 or in very small group.,11000000.0,EUR,12352243.0,4,Early Stage Venture,Less than $1M,Bpifrance,https://www.invivox.com/,"Bpifrance, Isai",2.0,,,,Yes
433,Seed Round - Volta Medical,https://www.crunchbase.com/funding_round/volta-medical-seed--ed241a82,"Artificial Intelligence, Health Care, Medical Device, Software","Marseille, Provence-Alpes-Cote d'Azur, France, Europe",Volta Medical,https://www.crunchbase.com/organization/volta-medical,Seed,2300000.0,EUR,2662733.0,2018-10-01,Seed,Volta Medical is an AI-driven start-up developing intelligent software solutions to guide cardiologists during interventional procedures.,68870570.0,USD,68870570.0,6,Early Stage Venture,,,https://www.volta-medical.com/,Groupe Pasteur Mutualité,1.0,,,,Yes
434,Seed Round - Moka.care,https://www.crunchbase.com/funding_round/moka-care-seed--ad325fb4,"Health Care, Wellness","Paris, Ile-de-France, France, Europe",Moka.care,https://www.crunchbase.com/organization/moka-care,Seed,2500000.0,EUR,2991862.0,2021-02-04,Seed,Moka.care is a firm that provides a complete solution for allowing your employees to take care of their mental health.,17500000.0,EUR,19091258.0,2,Early Stage Venture,Less than $1M,Singular,https://www.moka.care/,"Adrien Ledoux, Celine Lazorthes, Come Fouques, Florian Douetteau, Marc-Antoine de Longevialle, Nicolas Dessaigne, Ning Li, Pierre Dubuc, Roxanne Varza, Singular, Thibault Lamarque",11.0,,,,Yes
435,Seed Round - Braintale,https://www.crunchbase.com/funding_round/braintale-seed--81932287,"Health Care, Health Diagnostics, Medical Device","Paris, Ile-de-France, France, Europe",Braintale,https://www.crunchbase.com/organization/braintale,Seed,1000000.0,EUR,1182434.0,2020-11-09,Seed,Braintale develops and distributes diagnosis and prognosis tools for brain injured patients.,5500000.0,EUR,6096423.0,4,,,Angels Santé,https://www.braintale.fr/,"Angels Santé, Arts et Métiers Business Angels, Femmes Business Angels, Paris Business Angels",4.0,,,,Yes
436,Seed Round - Livmed's,https://www.crunchbase.com/funding_round/livmed-s-seed--a1fe138f,"Delivery Service, Health Care, Medical, Pharmaceutical, Software","Nice, Provence-Alpes-Cote d'Azur, France, Europe",Livmed's,https://www.crunchbase.com/organization/livmed-s,Seed,2000000.0,EUR,2254600.0,2021-12-07,Seed,Livmed's is a software platform that provides home medicine delivery services for fellow citizens and healthcare players.,7000000.0,EUR,7463678.0,2,Seed,,,https://livmeds.com,,,,,,Yes
437,Seed Round - Fizimed,https://www.crunchbase.com/funding_round/fizimed-seed--e0d994b8,"Fitness, Health Care, Software, Wellness","Strasbourg, Alsace, France, Europe",Fizimed,https://www.crunchbase.com/organization/fizimed,Seed,600000.0,EUR,741569.0,2018-03-23,Seed,Fizimed  is specializes in the development of connected medical devices for rehabilitation.,600000.0,EUR,741569.0,1,Seed,Less than $1M,Alsace Business Angels,http://www.fizimed.com/emy/en,"Alsace Business Angels, Bpifrance, Healthcare Angels, Women Business Angels Club",4.0,,,,Yes
438,Seed Round - Fempo,https://www.crunchbase.com/funding_round/fempo-seed--7728cea0,"Health Care, Wellness, Women's","Paris, Ile-de-France, France, Europe",Fempo,https://www.crunchbase.com/organization/fempo,Seed,,,,2018-01-01,Seed,FEMPO is French brand menstrual panty.,,USD,,1,Seed,,,https://fempo.co/,The Family,1.0,,,,Yes
439,Seed Round - PRAGMA Therapeutics,https://www.crunchbase.com/funding_round/pragma-therapeutics-seed--683d0fa8,"Biotechnology, Health Care, Pharmaceutical, Therapeutics","Saint-julien-en-genevois, Rhone-Alpes, France, Europe",PRAGMA Therapeutics,https://www.crunchbase.com/organization/pragma-therapeutics,Seed,1300000.0,GBP,1698595.0,2018-11-08,Seed,PRAGMA Therapeutics is an innovative medicines for stress disorders.,1300000.0,GBP,1698596.0,2,Seed,Less than $1M,,http://pragmatherapeutics.com/,,,,,,Yes
440,Seed Round - Circular | Be more,https://www.crunchbase.com/funding_round/circular-be-more-seed--123fe56f,"Fitness, Health Care, Internet of Things, Personal Health, Wearables, Wellness","Paris, Ile-de-France, France, Europe",Circular | Be more,https://www.crunchbase.com/organization/circular-be-more,Seed,,,,2021-01-01,Seed,Circular is on a mission to democratize personal health,,USD,,4,Seed,,,https://www.circular.xyz/,,,,,,Yes
441,Seed Round - Mojo,https://www.crunchbase.com/funding_round/mojofertility-seed--9a721aee,"Artificial Intelligence, Fertility, Health Care, Health Diagnostics, Machine Learning, Robotics, Wellness","Lyon, Rhone-Alpes, France, Europe",Mojo,https://www.crunchbase.com/organization/mojofertility,Seed,5000000.0,EUR,5536749.0,2019-11-18,Seed,Mojo enables people to manage their fertility proactively to expand their family-building potential.,5000000.0,EUR,5536749.0,3,Seed,,Inventure,https://mymojo.ai,"Doberman Forward, Hampus Jakobsson, Inventure, Josefin Landgård, Privilège Ventures",5.0,,,,Yes
442,Seed Round - Stimunity,https://www.crunchbase.com/funding_round/stimunity-seed--abb463f7,"Biotechnology, Health Care","Paris, Ile-de-France, France, Europe",Stimunity,https://www.crunchbase.com/organization/stimunity,Seed,2000000.0,EUR,2454168.0,2018-03-01,Seed,Stimunity is an early-stage research and development company focused on the development of STING agonists in cancer.,3500000.0,EUR,4105940.0,3,Seed,Less than $1M,Portage Biotech,https://stimunity.com/,Portage Biotech,1.0,,,,Yes
443,Seed Round - Leeto,https://www.crunchbase.com/funding_round/clan-seed--11dbc3e1,"Health Care, Human Resources, Information Technology, Software","Paris, Ile-de-France, France, Europe",Leeto,https://www.crunchbase.com/organization/clan,Seed,1200000.0,EUR,1318858.0,2019-09-01,Seed,Leeto empowers companies to take care of their employees,1200000.0,EUR,1318858.0,2,Seed,,,https://www.leeto.co,"Benjamin Netter, Benoit Portoleau-Balloy, Founders Future, Thomas Rebaud, Vincent Luciani",5.0,,,,Yes
444,Seed Round - MonSuiviDiet,https://www.crunchbase.com/funding_round/mon-suivi-diet-seed--60fc9d55,Health Care,"Venelles, Provence-Alpes-Cote d'Azur, France, Europe",MonSuiviDiet,https://www.crunchbase.com/organization/mon-suivi-diet,Seed,,,,2022-03-21,Seed,MonSuiviDiet is a digital tool that enables dietitians to stay in touch with their patients in between sessions and monitor their nutrition.,,USD,,1,Seed,,,https://www.monsuividiet.com,OBRATORI,1.0,,,,Yes
445,Seed Round - CALYSENS,https://www.crunchbase.com/funding_round/calysens-seed--b70486fb,Health Care,"Marseille, Provence-Alpes-Cote d'Azur, France, Europe",CALYSENS,https://www.crunchbase.com/organization/calysens,Seed,,,,2019-08-02,Seed,safe and effective cosmetic products reducing harmful effects induced by environment & endogenous factors leading to skin ageing.,,USD,,1,Seed,,,https://calysens.com/,OBRATORI,1.0,,,,Yes
446,Seed Round - FLOD AI,https://www.crunchbase.com/funding_round/flod-seed--404ad1b2,"Artificial Intelligence, Electronics, Hardware, Health Care, Internet of Things","Reims, Champagne-Ardenne, France, Europe",FLOD AI,https://www.crunchbase.com/organization/flod,Seed,221000.0,USD,221000.0,2018-01-01,Seed,FLOD develops a Structural Health Monitoring system based on a proprietary AI technology.,341000.0,USD,341000.0,2,Seed,Less than $1M,,https://flod.ai/,,,,,,Yes
447,Seed Round - Neurallys,https://www.crunchbase.com/funding_round/neurallys-seed--16a6349f,"Health Care, Medical Device","Paris, Ile-de-France, France, Europe",Neurallys,https://www.crunchbase.com/organization/neurallys,Seed,1500000.0,USD,1500000.0,2019-03-30,Seed,Neurallys provides medical devices for neurology and neurosurgery.,1500000.0,USD,1500000.0,2,Seed,Less than $1M,,http://neurallys.com,"Bpifrance, Doliam, HAC FUTUR",3.0,,,,Yes
448,Seed Round - Vetolib,https://www.crunchbase.com/funding_round/vetolib-seed--c8d1ce95,"Digital Marketing, Health Care, Pet, Veterinary","Paris, Ile-de-France, France, Europe",Vetolib,https://www.crunchbase.com/organization/vetolib,Seed,,,,2019-05-15,Seed,Vetolib help pet owners find great vets and book their appointments online.,,USD,,1,Seed,Less than $1M,Platina Partners,https://vetolib.vet/,Platina Partners,1.0,,,,Yes
449,Seed Round - MA FORMATION MEDICALE,https://www.crunchbase.com/funding_round/ma-formation-medicale-seed--b6b67c88,Health Care,"Marseille, Provence-Alpes-Cote d'Azur, France, Europe",MA FORMATION MEDICALE,https://www.crunchbase.com/organization/ma-formation-medicale,Seed,,,,2019-09-19,Seed,1st training search engine dedicated to healthcare professionals,,USD,,1,Seed,,,https://www.maformationmedicale.fr,OBRATORI,1.0,,,,Yes
450,Seed Round - Dreamtim Blooming,https://www.crunchbase.com/funding_round/dreamtim-blooming-seed--8738732d,"Health Care, Women's","Paris, Ile-de-France, France, Europe",Dreamtim Blooming,https://www.crunchbase.com/organization/dreamtim-blooming,Seed,411500.0,EUR,454512.0,2019-09-19,Seed,Dreamtim Blooming revolutionizing women's intimate health.,411500.0,EUR,454513.0,1,Seed,,Investessor,https://blooming.rocks/,"Cédric Delorme, Investessor",2.0,1500000.0,EUR,1656790.0,Yes
451,Seed Round - RemplaFrance,https://www.crunchbase.com/funding_round/remplafrance-seed--a2c9e6f4,"Health Care, Human Resources, Medical","Neuilly-sur-seine, Ile-de-France, France, Europe",RemplaFrance,https://www.crunchbase.com/organization/remplafrance,Seed,500000.0,EUR,616326.0,2018-02-22,Seed,"RemplaFrance services simplify administrative tasks in HR, contracting, and accounting for health workers.",500000.0,EUR,616327.0,1,Seed,,,http://www.remplafrance.com,INSEAD Business Angels Alumni France,1.0,,,,Yes
452,Seed Round - PAOS,https://www.crunchbase.com/funding_round/paos-seed--6a85b019,"Beauty, Health Care, Wellness","Paris, Ile-de-France, France, Europe",PAOS,https://www.crunchbase.com/organization/paos,Seed,,,,2021-02-01,Seed,PAOS designs solid organic cosmetics and natural cleaning products that can be used without packaging.,,USD,,1,Seed,,,https://paos.fr/,Angelsquare,1.0,,,,Yes
453,Seed Round - Mindday,https://www.crunchbase.com/funding_round/mindday-seed--906ab683,"Health Care, Wellness","Paris, Ile-de-France, France, Europe",Mindday,https://www.crunchbase.com/organization/mindday,Seed,2000000.0,EUR,2375550.0,2021-07-09,Seed,"Mindday provides programs, activities, content and tools as well as certified professionals.",2000000.0,EUR,2375551.0,1,Seed,,XAnge,https://www.mindday.com/,"Benjamin Hardy, Edward Lando, Gary Anssens, Guillaume Gibault, Hugo Mercier, Jeremy Le Van, Jon Oringer, Loïc Yviquel, Nadav Ben-Chanoch, Pareto Holdings, XAnge",11.0,,,,Yes
454,Seed Round - Qynapse,https://www.crunchbase.com/funding_round/qynapse-seed--d23fc94f,"Artificial Intelligence, Clinical Trials, Health Care, Information Technology, Machine Learning, Medical, Neuroscience, Software","Paris, Ile-de-France, France, Europe",Qynapse,https://www.crunchbase.com/organization/qynapse,Seed,1800000.0,USD,1800000.0,2018-07-01,Seed,Qynapse leverages neuroimaging & AI to advance the accuracy and reliability of Central Nervous System diseases screening and monitoring.,6600000.0,USD,6600000.0,4,Seed,$1M to $10M,,http://www.qynapse.com/,,,,,,Yes
455,Seed Round - Elmut,https://www.crunchbase.com/funding_round/elmut-seed--00c47304,"Agriculture, Delivery, E-Commerce, Food and Beverage, Health Care","Paris, Ile-de-France, France, Europe",Elmut,https://www.crunchbase.com/organization/elmut,Seed,842992.0,USD,842992.0,2021-04-01,Seed,Elmut is a fresh dogfood subscription that cooks and delivers fresh home-cooked meals for their dog.,3604125.0,USD,3604125.0,3,Seed,,,https://www.elmut.fr,,,,,,Yes
